timestamp,event_id,longitude,latitude,tipo,economia,atencion,mensaje,municipio
2020-04-11 02:06:54,1752,-99.12395500000001,19.488726100000004,Otro,Demanda,Pendiente,Económico  Desempleo,Gustavo A. Madero
2020-04-11 02:25:10,1753,-88.296146,18.5001889,Otro,Demanda,Pendiente,Una semana  Para poder comprar despensa para poder pasar todo esto de la enfermedad ya que tenemos un bebe no nos damos a basto con los gastos,Othón P. Blanco
2020-04-11 02:27:44,1754,-88.296146,18.5001889,Otro,Demanda,Pendiente,Una semana  No tengo trabajo por el momento,Othón P. Blanco
2020-04-11 03:13:32,1755,-99.22156590000002,18.9242095,Otro,Demanda,Pendiente,Cuando sea posible Corto No tengo sueldo fijo si vendo tengo. Si no no tengo,Cuernavaca
2020-04-11 03:14:42,1756,-99.6132583,18.5426307,Otro,Demanda,Pendiente,Para medidas de alimentación  Para poder comprar alimentos para mí familia,Taxco de Alarcón
2020-04-11 03:36:07,1759,-99.2065202,19.777467899999998,Otro,Demanda,Pendiente,Apoyo con alimentos Ayuda para conseguir trabajo estable Vivo al día de lo que vendo en mi puesto de cosas usadas y ahora ya no hay nada de venta,Coyotepec
2020-04-11 05:06:11,1764,-106.4203435,23.2271169,Otro,Demanda,Pendiente,"Solicito el apoyo para completar el pago de mi renta y otros gastos corrientes. Empleo Soy estudiante de música en Mazatlán, Sinaloa y me quedé sin ingresos por la cuarentena.",Mazatlán
2020-04-11 05:57:24,1765,-88.327575,18.5137352,Otro,Demanda,Pendiente,"3 meses 6 meses Soy madre soltera de tres hijos , y estoy en desempleo.",Othón P. Blanco
2020-04-11 06:25:08,1768,-99.1753699,18.865223800000003,Otro,Demanda,Pendiente,Corto plazo Mediano plazo Por desempleo,Jiutepec
2020-04-11 06:32:36,1770,-88.30206020000001,18.5001577,Otro,Demanda,Pendiente,Si lo necesito lo mas pronto pocible para poder sustentar comida mas que nada para mis dos hijos de antemano muchas gracias  Soy madre soltera y me e quedado sin trabajo tiene una semana y vivo al dia,Othón P. Blanco
2020-04-11 06:39:29,1771,-88.30206020000001,18.5001577,Otro,Demanda,Pendiente,"800 1000 Soy una señora de 45 años trabajaba de limpieza de casa, asta hace 3 semanas que la señora me mandó a descansar que porq ya no tendría más trabajo para mí sin ninguna liquidación, ahorita me las estoy viendo difícil porq no tengo trabajo tengo una hija de 15 años la cual tengo que mantener y pues no cuento con recursos! Sería muy grato que le pudiecen ayudar! De antemano gracias",Othón P. Blanco
2020-04-11 06:53:39,1772,-99.2016738,18.8139073,Otro,Demanda,Pendiente,Apollo con leche para bebé y pañales y un poco de despensa Apollo con útiles escolares Soy madre de tres pequeños yo trabajo como obrera en una fábrica ahorita llevo un mes sin poder trabajar ya que mi bebé está pequeño tiene cuatro meses y me mandaron en cuarentena y para mí es muy difícil está situacion por mis niños que dios bendiga su gran labor.,Emiliano Zapata
2020-04-11 07:07:39,1774,-98.9507554,19.2848553,Otro,Demanda,Pendiente,Despensa Si Despensa,Valle de Chalco Solidaridad
2020-04-11 07:23:45,1775,-99.207848,19.2721484,Otro,Demanda,Pendiente,Corto plazo Mediano plazo Buenas tardes pues es que yo soy del estado de guerrero pero me vine a trabajar a la DF para ayudar a mi mamá que se encuentra enferma de un pie y no puede trabajar y para mantener a mi niña yo soy mamá soltera trabajaba en una zapatearía pero el dueño me despido por la contingencia de coronavirus ya no podía pagar mi sueldo y me despedido de un día para otros y pues ahorita no estoy trabajando mis pocos ahorros ya se me terminaron y no tengo a nadie que me apoye o me ayude y pues no sé qué hacer salgo a la calle a buscar trabajo pero lo encuentro en ningún lago,Tlalpan
2020-04-11 07:31:02,1776,-99.10134980000001,18.6813049,Otro,Demanda,Pendiente,Un mes Dos meses Madre soltera,Tlaltizapán
2020-04-11 07:38:06,1778,-99.22156590000002,18.9242095,Otro,Demanda,Pendiente,"No entiendo  Estoy desempleado, soy diabético",Cuernavaca
2020-04-11 08:36:44,1779,-99.190678,18.8194919,Otro,Demanda,Pendiente,una semana  alimenticia por falta de recursos debido al desempleo,Emiliano Zapata
2020-04-11 08:52:02,1780,-99.19336640000002,19.507720499999998,Otro,Demanda,Pendiente,Despensa  Situación económica por la que estoy pasando debido ala situación que se vive en estos momentos,Azcapotzalco
2020-04-11 08:58:08,1781,-99.19336640000002,19.507720499999998,Otro,Demanda,Pendiente,Despensa  Por mi situación económica y por la situación que estamos pasando,Azcapotzalco
2020-04-11 09:58:53,1784,-99.1608372,18.906403,Otro,Demanda,Pendiente,7772252215  Tengo un trabajo informal,Jiutepec
2020-04-11 10:23:41,1785,-99.1968277,18.9517043,Otro,Demanda,Pendiente,Alimentos para núcleo familiar  Medias de alimentación,Cuernavaca
2020-04-11 10:35:08,1786,-98.9328137,19.287208800000002,Otro,Demanda,Pendiente,"Canasta básica, frijol arroz, huevo, leche, sopas etc. Cuento con un auto y me dicen que también ofrecen trabajo haciendo entregas Porque no cuento con trabajo tengo esposa y dos hijos y ya no logro salir con los gastos diarios.",Valle de Chalco Solidaridad
2020-04-11 10:48:23,1787,-99.1608372,18.906403,Otro,Demanda,Pendiente,5000 8000 desempelo,Jiutepec
2020-04-11 10:55:58,1788,-99.1968277,18.9517043,Otro,Demanda,Pendiente,De corto plazo si esto acaba pronto primero Dios Si sea necesario a largo plazo por que todo es incierto en estos momentos sólo hay que ser personas en obediencia para que esto no crezca Me quede sin trabajo por la pandemia del COVID 19,Cuernavaca
2020-04-11 11:03:45,1789,-99.133208,19.4326077,Otro,Demanda,Pendiente,Apoyo de despensa  Me encuentro sin salario por el asunto del Coronavirus,Cuauhtémoc
2020-04-11 11:25:07,1790,-99.1968277,18.9517043,Otro,Demanda,Pendiente,Corto Mediano Para mantener a mis hijos con una despensa,Cuernavaca
2020-04-11 11:48:25,1792,-99.20634720000001,18.9812122,Otro,Demanda,Pendiente,Urgente  Falta de trabajo por covid 19,Cuernavaca
2020-04-11 11:54:39,1793,-99.20634720000001,18.9812122,Otro,Demanda,Pendiente,Me urge  Me quedé sin trabajo por cuarentena por el covid19,Cuernavaca
2020-04-12 12:07:13,1794,-99.0578,19.4482611,Otro,Demanda,Pendiente,No Si Perdí mi empleo por la contingencia,Venustiano Carranza
2020-04-12 12:18:41,1795,-99.1829833,18.8994216,Otro,Demanda,Pendiente,Ayuda economica Ayuda económica Desempleo por covid-19,Jiutepec
2020-04-12 12:51:07,1796,-99.2016738,18.8139073,Otro,Demanda,Pendiente,"6,000 para un plazo de un año  Soy tianguistas mi giro es ropa de segunda mano.por lo del covid19 no puedo salir a vender, o como puedo obtener la beca para mis hijos de kinder y primaria",Emiliano Zapata
2020-04-12 01:42:28,1797,-99.1110308,19.2415684,Otro,Demanda,Pendiente,"Solicito trabajo o algún apoyo para crear recursos para llevar de comer a mi casa Estar produciendo recursos para sacar adelante a mis hijos mientras dura la pandemia Padre soltero de 4 hijos sin trabajo por cuarentena. Soy protesista dental, y vivo del trabajo diario!",Xochimilco
2020-04-12 05:18:00,1799,-99.0267076,19.5537188,Otro,Demanda,Pendiente,"Con esta situación el trabajo ha bajado mucho y ya no me es posible ayudarlo como antes y me preocupa mucho si está pasando hambre, no se cómo ayudarlo.
El señor no tiene ningún tipo de ayuda del gobierno federal o estatal, no pensión ni nada Yo puedo enviar evidencia de lo que digo por si existen dudas, no busco sacar provecho ni nada por el estilo, solo me gustaría le ayuden por favor.  Para un adulto de la tercera edad en situación de abandono, el recolecta botellas y desperdicios para sobrevivir.
Hace mandados para ganarse la vida",Ecatepec de Morelos
2020-04-12 08:59:32,1800,-98.3225325,19.0565196,Otro,Demanda,Pendiente,"Despensa  Mi marido y yo nos quedamos sin trabajo por la contingencia, él trabajaba de mesero y yo en el spa de un hotel, el cual han cerrado y con tres hijos es muy complicado, nuestros ahorros se han agotado!",San Pedro Cholula
2020-04-12 09:00:39,1801,-86.83458409999999,21.162626,Otro,Demanda,Pendiente,"Dinero para renta ya que vence el 15 de abril Ideas para generar ingresos Hola y perdón la realidad estoy desesperado ya que yo vivía en del turismo y en 15 días todos cerro estaba al día sin la posibilidad de realizar un ahorró, además que la persona que me podría apoyar que es mi padre sufrio un infarto, ahora tengo 4 semana sin trabajar además soy hipertenso viviendo en Cancún lugar por excelencia de turismo no hay empleos si es posible me pueden ayudar ya que pago renta y necesito productos de la canasta básica, además si tienen alguna idea de cómo pudo generar algún ingreso se los agradezco mucho Que Dios los bendiga abundantemente",Benito Juárez
2020-04-12 11:22:17,1803,-99.1802147,18.867191100000003,Otro,Demanda,Pendiente,Despensa Renta Desempleo me dedicaba a hacer aseo en casas,Jiutepec
2020-04-12 11:29:39,1807,-99.20790500000001,18.9688106,Otro,Demanda,Pendiente,Corto Monetario Tengo dos niñas soy mamá soltera,Cuernavaca
2020-04-12 11:41:13,1810,-99.0218721,19.3292295,Otro,Demanda,Pendiente,Por el motivo que tengo 2 hijos y una pareja y soy diabetico A largo plazo Me quede sin trabajo por covi 19t,Iztapalapa
2020-04-12 12:39:32,1812,-99.0654022,19.4103067,Otro,Demanda,Pendiente,Una despensa para poder pasar esta contingencia  Soy una persona mayor de edad que paga renta y no tengo ingresos ahorita,Iztacalco
2020-04-12 12:52:07,1813,-99.21413659999999,19.3343205,Otro,Demanda,Pendiente,3000 aproximadamente  Requerimiento para pasar la pandemia,La Magdalena Contreras
2020-04-12 01:12:15,1814,-99.25777149999999,19.4757031,Otro,Demanda,Pendiente,Ayuda para despensa  Trabajo en casa y m descansaron sin sueldo,Naucalpan de Juárez
2020-04-12 03:00:14,1816,-99.23144920000001,18.866121399999997,Otro,Demanda,Pendiente,Apoyo x contingencia Pues apoyo x edad Desempleo,Temixco
2020-04-12 03:11:56,1817,-98.8997015,19.2829343,Otro,Demanda,Pendiente,"Despensa  Falta de ingreso económico , tres hijos una recién nacida. Despensa.",Chalco
2020-04-12 03:23:06,1819,-99.1968277,18.9517043,Otro,Demanda,Pendiente,Medidas de alimentación  Gastos económicos de alimento,Cuernavaca
2020-04-12 06:14:52,1824,-99.1774462,18.890867999999998,Otro,Demanda,Pendiente,"Alimento, despensa Luz y agua Realmente necesitamos su apoyo, necesito alimento para poder comer, estoy desempleado y mi familia y yo nos la vemos muy difícil",Jiutepec
2020-04-12 06:46:04,1826,-99.1968277,18.9517043,Otro,Demanda,Pendiente,Cortó plazo! Estoy desempleado por recorte de personal en mi antiguo trabajo  Manutención de mi familia,Cuernavaca
2020-04-12 07:05:39,1827,-99.6132583,18.5426307,Otro,Demanda,Pendiente,Corto plazo Mediano plazo Alimentacion,Taxco de Alarcón
2020-04-12 07:08:34,1828,-99.03361590000002,19.3868443,Otro,Demanda,Pendiente,"corto plazo Si Soy comerciante ambulante del centro de la ciudad de mexico y por ese motivo no puedo trabajar Por El covid 19 El papa de mis hijos nos abandono por otra familia y no se hace responsable de mis hijos
Y por este momento no tengo trabajo
Y no tengo como alimentar a mis hijos
Gracias",Iztapalapa
2020-04-12 07:13:41,1829,-100.14581779999999,25.7081332,Otro,Demanda,Pendiente,Mientras dure la contingencia  Desempleos por covid-19,Apodaca
2020-04-12 07:14:56,1830,-99.6132583,18.5426307,Otro,Demanda,Pendiente,corto plazo mediano alimentos,Taxco de Alarcón
2020-04-12 07:20:48,1831,-100.14581779999999,25.7081332,Otro,Demanda,Pendiente,Mientras pasa la contingencia  Desempleobpor covid-19,Apodaca
2020-04-12 07:22:14,1832,-100.2943696,25.6786499,Otro,Demanda,Pendiente,Ayuda Mientras termina la contingencia Ayuda mientras termina la contingencia Desempleo por covid-19,Monterrey
2020-04-12 07:35:08,1833,-99.1774462,18.890867999999998,Otro,Demanda,Pendiente,"Despensa Gas Estoy embarazada, desempleada, 2 hijas.",Jiutepec
2020-04-12 07:46:26,1834,-99.21829129999999,19.2752051,Otro,Demanda,Pendiente,Cubrebocas n95  En mi trabajo los insumos son escasos,Tlalpan
2020-04-12 07:56:54,1835,-99.1829833,18.8994216,Otro,Demanda,Pendiente,Terapia  Apoyo Psicológico,Jiutepec
2020-04-12 08:47:25,1836,-99.19405859999999,19.5025286,Otro,Demanda,Pendiente,"Despensa  Debido ala situación que está pasando, no tengo los ingresos suficientes",Azcapotzalco
2020-04-12 08:50:35,1837,-99.2030585,19.4556639,Otro,Demanda,Pendiente,1 a un mes 2 meses Economica,Miguel Hidalgo
2020-04-12 08:51:20,1838,-99.1698333,19.6223825,Otro,Demanda,Pendiente,Despensa  Me quedé sin trabajo por lo del coronavirus,Tultitlán
2020-04-12 08:55:37,1840,-99.1252086,19.35906,Otro,Demanda,Pendiente,Dinero préstamo Mediano No estoy recibiendo ingresos en mi trabajo,Iztapalapa
2020-04-12 09:08:13,1841,-99.02878,19.5086611,Otro,Demanda,Pendiente,Despensa para que podamos comer en esta contingencia Durante la contingencia porque ya pasando esto puedo regresar a trabajar Me descansaron de mi trabajo x q soy hipertensa depende de mí mi hija mi nieta q su mamá me la dejo y pago renta y no estoy saliendo con los gastos,Ecatepec de Morelos
2020-04-12 09:10:50,1842,-99.15737740000002,19.466822399999998,Otro,Demanda,Pendiente,Requiero ayuda solo para pasar la contingencia y yo poder regresar a trabajar Yo pretendo seguir trabajando en cuanto la situación lo permita Cerraron la fábrica donde trabajaba mi esposo tiene su pensión pero es muy baja,Azcapotzalco
2020-04-12 09:29:15,1844,-99.1774462,18.890867999999998,Otro,Demanda,Pendiente,No ahí ventas No vendemos No tengo ventas,Jiutepec
2020-04-12 10:12:54,1845,-99.60177840000001,18.561941100000002,Otro,Demanda,Pendiente,"Corto plazo Mediano Porque soy madre de dos niños y madre soltera, mi mama tambien depende de mi y rentamos la casa donde vivimos por que no tenemos hogar propio, tambien pagamos luz y agua, ahorita ya nos quieren correr porque tenemos un les vencido",Taxco de Alarcón
2020-04-12 10:15:44,1846,-99.20790500000001,18.9688106,Otro,Demanda,Pendiente,Si  No tengo trabajo,Cuernavaca
2020-04-12 10:45:10,1848,-99.0654022,19.4103067,Otro,Demanda,Pendiente,Apoyo económico o en especie 2 a 4 semanas Por que no estoy trabajando por la pandemia,Iztacalco
2020-04-12 10:56:04,1849,-100.14581779999999,25.7081332,Otro,Demanda,Pendiente,"Inmediato Dispuesto Desempleado
Desempleado",Apodaca
2020-04-12 11:04:29,1850,-99.5995528,18.5777574,Otro,Demanda,Pendiente,Me hace falta comprar despensa Falta de recursos para comprar Me quede sin vender mi artesania,Taxco de Alarcón
2020-04-12 11:22:21,1851,-99.20790500000001,18.9688106,Otro,Demanda,Pendiente,"Para la comida diaria, ya que no tengo trabajo desde hace 3 semanas y mis papás también no trabajan y tengo un hijo de un año Largo plazo Madre soltera",Cuernavaca
2020-04-12 11:41:18,1852,-99.0218721,19.3292295,Otro,Demanda,Pendiente,Requiero de abasto o lo que sepueda Amediano plaso Mequede sin trabajo por covi 19,Iztapalapa
2020-04-12 11:59:14,1853,-99.1553016,18.8890199,Otro,Demanda,Pendiente,900 Mediano Apoyo para gastos alimenticios,Jiutepec
2020-04-13 12:03:50,1854,-99.1276295,18.881555300000002,Otro,Demanda,Pendiente,Contingencia Largo plazo Para mantener en esta contingencia a mis hijos,Jiutepec
2020-04-13 12:07:25,1855,-99.20790500000001,18.9688106,Otro,Demanda,Pendiente,24 hora  No tengo trabajo,Cuernavaca
2020-04-13 12:35:35,1856,-98.27326590000001,19.0941283,Otro,Demanda,Pendiente,Alimento Empleo No tengo trabajo,Cuautlancingo
2020-04-13 12:51:06,1857,-96.72658890000001,17.0731842,Otro,Demanda,Pendiente,"Si lo requiero  Me quede sin trabajo, soy maestra de pintura y estoy por honorarios, cuando empezó el confinamiento deje de dar clases. Estoy con mis padres que son adultos mayores y mi hermana que es madre soltera ella y yo somos las que solventamos los gastos, pero ahorita solo es ella quien está apoyando la situación en nuestra casa.",Oaxaca de Juárez
2020-04-13 01:00:54,1858,-99.1276295,18.881555300000002,Otro,Demanda,Pendiente,"PAGOS ESCOLARES Y COMIDA SEGUIR MIS ESTUDIOS APOYO PARA LA EDUCACIÓN,COMIDA Y VIVIENDA",Jiutepec
2020-04-13 01:56:12,1860,-109.9236351,22.893269,Otro,Demanda,Pendiente,3 meses 6 meses Leche pañales toallitas húmedas y comida,Los Cabos
2020-04-13 09:10:32,1861,-99.1802147,18.867191100000003,Otro,Demanda,Pendiente,2000 1500 Gastos alimenticios de mi familia.,Jiutepec
2020-04-13 09:11:03,1862,-99.2272939,18.8236701,Otro,Demanda,Pendiente,"1,000 1,000 Gastos de alimentación",Temixco
2020-04-13 09:16:10,1864,-99.1843676,18.8478608,Otro,Demanda,Pendiente,1500 2000 Desempleo,Emiliano Zapata
2020-04-13 10:01:17,1865,-98.3225325,19.0565196,Otro,Demanda,Pendiente,"Canasta básica Productos de canasta básica La verdad es que mi marido y no nos quedamos sin trabajo, no nos están pagando por esta contingencia ya que trabajamos sin contrato y con salario mínimo, tenemos tres hijos por esa razón necesitamos de su ayuda por favor, de ante mano les su ayuda....",San Pedro Cholula
2020-04-13 10:11:08,1867,-101.93765970000001,21.3540813,Otro,Demanda,Pendiente,1300 1500 Compra de alimentos basicos,Lagos de Moreno
2020-04-13 10:22:51,1869,-99.2016738,18.8139073,Otro,Demanda,Pendiente,Corto plazo Mediano Porq trabajo en el campo y mis padres son de la tercera edad somos muchos en casa,Emiliano Zapata
2020-04-13 11:18:11,1871,-99.133208,19.4326077,Otro,Demanda,Pendiente,Corto plazo leche enfamil prometal confort  Soy taxista de ucop y no tengo trabajo y tengo un bebé recién nacido,Cuauhtémoc
2020-04-13 11:23:26,1872,-99.13316309999999,19.455523499999998,Otro,Demanda,Pendiente,Insulina dado q soy diabética y cuesta muy cara Insulina Soy taxista de ucop y no tengo trabajo,Cuauhtémoc
2020-04-13 11:29:15,1873,-100.71894549999999,20.9021801,Otro,Demanda,Pendiente,"Comida, despensa, artículos de higiene personal.  Porque mi centro de trabajo es un parque recreativo y este momento cerro.",San Miguel de Allende
2020-04-13 11:47:16,1874,-99.1802147,18.920157800000002,Otro,Demanda,Pendiente,Salir de esta situación Sacar a mis niños adelante Por la situación de la contingencia,Jiutepec
2020-04-13 11:53:35,1875,-99.2037508,18.808656399999997,Otro,Demanda,Pendiente,una semana  Persona de la tercera edad,Emiliano Zapata
2020-04-13 12:16:08,1876,-99.2023662,19.2811638,Otro,Demanda,Pendiente,ayuda en despensa A mediano plazo no tengo trabajo desde el año pasado y soy el sostén dé dos hijos y mi mamá,Tlalpan
2020-04-13 12:21:36,1877,-103.38039029999999,20.673337300000004,Otro,Demanda,Pendiente,Economico Economico Estoy desempleada,Guadalajara
2020-04-13 12:31:04,1878,-103.3496092,20.6596988,Otro,Demanda,Pendiente,Lo q dure l contingencia Mediano Sin empleo,Guadalajara
2020-04-13 12:36:08,1879,-99.73263979999999,19.2952666,Otro,Demanda,Pendiente,Apoyo con viveres y meficamento (para la pequeña) Trabajo desde casa (cuento con maquina de coser) La familia trabajaba en un circo (ya tenemos desde el 15de marzo sin laborar) el dinero y los insumos se estan acabando y nos da miedo salir a buscar el sustento pues mi pequeña tiene dignostico de asma contagiarnos pone en riesgo su vida .a ella la atienden en el hospital feferico gomez .les prdimos ayuda para lavorar desde casa somos 6 perzonas que podemos lavorar,Zinacantepec
2020-04-13 12:41:01,1880,-99.1103392,19.3174558,Otro,Demanda,Pendiente,De despensa para poder darles de comer a hijos y al señor de 92años Si a corto plazo Para mis hijos y un señor de avansda edad y le llevó de comer porque sus hijos se olvidan de el,Coyoacán
2020-04-13 12:41:30,1881,-93.1829868,16.7167712,Otro,Demanda,Pendiente,si si me quedé desempleado y soy responsable de mi padre y mis hermanos,Tuxtla Gutiérrez
2020-04-13 12:43:31,1882,-99.06125540000001,19.3176966,Otro,Demanda,Pendiente,"Alimentos que puedan cubrir una semana, para 2 personas  Desde hace 20 días suspendieron actividades en mi trabajo, y sin ningún tipo de remuneración económica.
A estas alturas lo poco que tenia como ahorro se me esta acabando, la ayuda consistiria en solo para una semana de alimentación, en lo que encuentro algún trabajo en estos tiempos, solo somos mi esposa y yo.",Iztapalapa
2020-04-13 01:02:40,1883,-99.098584,19.361500399999997,Otro,Demanda,Pendiente,Ayuda de despensa Si Desempleo por covid19,Iztapalapa
2020-04-13 01:07:08,1884,-101.57312420000001,21.045061899999997,Otro,Demanda,Pendiente,Si mediano Falta de comida por suspensión de trabajo,León
2020-04-13 01:12:58,1885,-99.79225090000001,18.5001186,Otro,Demanda,Pendiente,"Con el apoyo podré solventar mis gastos durante este periodo de cuarentena.  Mi trabajo es particular, doy terapias de rehabilitación a domicilio y no puedo salir a trabajar por la contingencia sanitaria que está presentando el país.",Ixcateopan de Cuauhtémoc
2020-04-13 01:19:03,1888,-103.342846,20.6967282,Otro,Demanda,Pendiente,Ayuda para está cuarentena Ayuda Crisis económica por la contingencia,Guadalajara
2020-04-13 01:45:06,1889,-99.0654022,19.4103067,Otro,Demanda,Pendiente,2 meses  Para pagar renta,Iztacalco
2020-04-13 02:09:21,1891,-99.2272939,18.9413586,Otro,Demanda,Pendiente,"Recibo con gusto el apoyo que este en sus manos brindarme. Lo dejo en sus manos,que dios los bendiga. Mi ingreso bajo demasiado esta semana ya no alcanzo a cubrir mis gastos, ya que me dieron de Baja en el Trabajo esta quincena,soy mama soltera y Tengo a cargo mis dos hijos y mi madre.a agradesco me tomen en cuenta y sobre su ayuda,gracias.",Cuernavaca
2020-04-13 03:01:08,1892,-99.1968277,18.9517043,Otro,Demanda,Pendiente,Para alimentación  Para sostener a mi familia durante la contingencia,Cuernavaca
2020-04-13 03:02:01,1893,-99.19561929999999,18.8303457,Otro,Demanda,Pendiente,Largo plazo Largo plazo Apoyos alimenticioscorto plazo,Emiliano Zapata
2020-04-13 03:46:12,1894,-99.28271629999999,19.3566017,Otro,Demanda,Pendiente,"Pañales desechables tipo calzón talla grande y productos de la canasta básica: arroz, frijol, huevo, leche, azúcar, fruta, verdura. Pañales desechables tipo calzón talla grande y productos de la canasta básica: arroz, frijol, huevo, leche, azúcar, fruta, verdura. Soy adulto mayor, diabética y discapacitada, no tengo los dos piernas. Y mi hija que es la que me sostiene económicamente no está trabajando ya que vende productos en la calle.",Cuajimalpa de Morelos
2020-04-13 04:11:32,1895,-100.8084675,20.548722199999997,Otro,Demanda,Pendiente,"Filamento PLA 1.75 mm para impresora 3D, ABS, Acetato para terminar las máscarillas Donaciones en efectivo para comprar una impresora 3D doble extrusor y aumentar la capacidad de fabricación Necesito donaciones en Efectivo o en especie para fabricar Diademas para Trabajadores de la salud",Celaya
2020-04-13 04:22:20,1896,-99.2189838,19.3569024,Otro,Demanda,Pendiente,Alimentos Pago de renta No tengo trabajo se cerró por la pandemia,Álvaro Obregón
2020-04-13 04:30:15,1897,-99.25777149999999,19.4757031,Otro,Demanda,Pendiente,Ayuda económica  Tengo más de un mes sin empleo debido a la contingencia y no recibo apoyo por parte de mis jefes,Naucalpan de Juárez
2020-04-13 05:00:36,1901,-99.152534,19.475171,Otro,Demanda,Pendiente,Descanso de trabajo Viuda 2 hijos m descansaron del trabajo Desempleo,Azcapotzalco
2020-04-13 05:40:52,1906,-93.7612856,16.086946100000002,Otro,Demanda,Pendiente,1 Mes  No tengo trabajo y necesito apoyar a mi bebé y a mis padres,Tonalá
2020-04-13 05:42:52,1907,-99.1968277,18.9517043,Otro,Demanda,Pendiente,Si No se Desempleo,Cuernavaca
2020-04-13 05:53:46,1908,-99.1774462,18.890867999999998,Otro,Demanda,Pendiente,"Corto Pues largo plazo Soy madre soltera de dos hijos pequeños y trabajo en una cocina económica el cual solo me están dando un día de trabajo, y estoy un poco preocupada por la cituación",Jiutepec
2020-04-13 06:12:50,1909,-99.1649891,19.3287038,Otro,Demanda,Pendiente,Si No me preocupa Hola necesito ayuda por favor no puedo trabajar tengo ansiedad y artritis y una bebé y mi esposo se quedó sin trabajo vivo en un cuarto pequeño,Coyoacán
2020-04-13 06:16:52,1911,-86.8433672,21.1464133,Otro,Demanda,Pendiente,5000  Por desempleo debido a Coronavirus,Benito Juárez
2020-04-13 06:32:43,1912,-99.2134442,18.9273354,Otro,Demanda,Pendiente,Apoyo economico Largo Me quedé sin trabajo,Cuernavaca
2020-04-13 06:34:59,1913,-99.60512059999999,18.5565468,Otro,Demanda,Pendiente,corto plazo  desenpliada,Taxco de Alarcón
2020-04-13 06:35:49,1914,-99.2134442,18.9273354,Otro,Demanda,Pendiente,Apoyo economico Largo Me quedé sin empleo,Cuernavaca
2020-04-13 07:17:15,1916,-99.5311939,18.3280249,Otro,Demanda,Pendiente,Apoyo para la alimentacion Mediano Estoy desempleado temporalmente por el covid19,Iguala de la Independencia
2020-04-13 07:23:51,1918,-99.1968277,18.9517043,Otro,Demanda,Pendiente,"Estoy requiriendolo a corto plazo debido a que solo trabajo 2 días y lo que gano en esos dos días no nos alcanza para todo la semana aunque lo administremos bien :(  La razón principal por la que solicito el apoyo es porque mis 2 hermanos menores y mi mamá dependen de mi, debido a que mi padre nos abandono cuando mi mamá enfermo sufre hipertensión y mareos constantes y ahora yo soy el que me hago cargo, estaba trabajando en una pizzeria pero ahora solo trabajo dos días debido a esta sitación , antes trabajaba toda la semana, pero ahora no, también tengo que solventar los gastos de mis hermanos menores ya que ellos por su edad no trabajan, espero ser considerado en el apoyo y te antemano muchas muchas gracias.",Cuernavaca
