timestamp,event_id,longitude,latitude,tipo,economia,atencion,mensaje,municipio
2020-04-04 08:55:37,254,-99.13869720000001,19.4522974,Farmacia,Oferta,Pendiente,Para hacerles llegar el medicamento.,Cuauhtémoc
2020-04-07 09:40:23,360,-99.1253549,19.3335822,Farmacia,Oferta,Pendiente,Medicamentos y despensa,Coyoacán
2020-04-07 11:54:23,363,-99.18930390000001,19.301885100000003,Farmacia,Oferta,Pendiente,Medicamentos. Alimentos,Tlalpan
2020-04-09 12:50:12,387,-103.38039029999999,20.699620899999996,Farmacia,Oferta,Pendiente,"MEDICAMENTOS CLOPIDOGREL (PLAVIX), ATORVASTATINA (LIPITOR), TRAMADOL,  ALENDRONATO, SERETIDE, FLUTICASONA, TAMSULOSINA, OMEPRAZOL, NORFENON, CALCITRIOL, AMLODIPINO, ESTROGENOS CREMA",Guadalajara
2020-04-12 09:38:00,450,-99.0073673,19.4102526,Farmacia,Oferta,Pendiente,Medicamentos Medicamentos de especialidad,Nezahualcóyotl
2020-04-12 01:47:43,455,-99.19267409999999,19.6455307,Farmacia,Oferta,Pendiente,Efectivo Alimentos y medicamento,Cuautitlán Izcalli
2020-04-13 02:50:19,473,-100.9980113,22.1573935,Farmacia,Oferta,Pendiente,Médico ortopedista consulta en línea de padecimientos deIrtopedia Consulta médica ,San Luis Potosí
2020-04-21 12:55:42,538,-122.0281098,37.33228737,Farmacia,Oferta,Resuelta,Algo,other
2020-04-01 06:26:26,555,-99.133208,19.4326077,Farmacia,Demanda,Pendiente,"Despensa Y lo que solicitaria seria ayuda em despensa ya que por la tarde vendra una doctora amiga a ver a mi hija por que tiene tos y me mandara el.medicamento y ya podre saber que requiere Soy madre comerciante y mi esposo chófer de Uber y no hay trabajo, tengo dos pequeñas una de 13 y de 8 y lei que aqui ayudan a familias, no tenemos covid pero",Cuauhtémoc
2020-04-01 06:39:57,559,-99.0317993,19.328674300000003,Farmacia,Demanda,Pendiente,"Una despensa,, arroz,, frijol,, aceite, atún,,sopa,,jabón,,sal,, azúcar,leche ,, papel,, higiénico y medicamentos ,, pantoprazol 20 MG, panclasa cápsulas,dolac sublingual 30 MG tabletas A corto plazo Sin trabajo por la pandemia que hay",Iztapalapa
2020-04-01 08:44:34,565,-99.133208,19.4326077,Farmacia,Demanda,Pendiente,"Despensa para 2 personas Y medicamento para mis crisis
Fenitoina 100mg
Carbamazepina  Sufro de epilepsia no me dan trabajo
Desde casa preparaba postres y los vendia a domicilio, con ese ingreso y el de mi esposo nos manteniamos a flote.
Las 2 ultimas semanas mi venta bajo mucho y a mi esposo lo dieron de baja temporal en su trabajo hace una semana, sin sueldo.",Cuauhtémoc
2020-04-02 08:12:47,615,-99.112429,19.429921,Farmacia,Demanda,Pendiente,Alimentos y medicamento eutirox Económico si es posible para servicios Economico,Venustiano Carranza
2020-04-02 09:24:08,619,-99.0754244,19.673981,Farmacia,Demanda,Pendiente,Dinero para poder cubrir sus medicamentos  Para atender las alergias de hijo ya que los médicamente que requiere son costosos y mi esposo por el momento no está ganando lo suficiente debido a la escasez de trabajo ante la crisis sanitaria,Tultitlán
2020-04-02 09:48:33,621,-99.4987375,19.3635835,Farmacia,Demanda,Pendiente,Para despensa Para mis medicamentos Por enfermedad tengo cáncer trabajo de limpieza en casa pero me anda descansado no tengo para mis medicamentos ni para comer,Lerma
2020-04-03 03:37:08,646,-98.96593990000001,19.4447294,Farmacia,Demanda,Pendiente,"Si, alimentos Si, alimentos y medicamentos Somos personas de escasos recursos",Chimalhuacán
2020-04-03 06:25:03,650,-98.20627270000001,19.041439800000003,Farmacia,Demanda,Pendiente,ALIMENTOS MEDICAMENTO SOY MUJER VIUDA SUFRO DE ARTITIS,Puebla
2020-04-04 08:24:12,749,-99.0610804,19.5085008,Farmacia,Demanda,Pendiente,Pago de servicios y despensa para mi familia Medicamentos para la deabetes e hipertensión Soy madre soltera y no estoy trabajando,Ecatepec de Morelos
2020-04-04 09:26:07,764,-99.131088,19.418059,Farmacia,Demanda,Pendiente,comida y gas medicamento me despidieron del trabajo en diciembre y no consigo trabajo y en este momento menos,Cuauhtémoc
2020-04-05 09:03:24,795,-88.2813944,18.528159,Farmacia,Demanda,Pendiente,Para paga mis servicios yalimentacio Pues x el momento es por la alimentación y medicamentos y supcidios Soy vendedora ambulante y madre soltera de dos hijos,Othón P. Blanco
2020-04-05 10:56:48,802,-99.0798926,19.3467093,Farmacia,Demanda,Pendiente,"Medicamento y alimento  Crisis financiera por la contingencia, desafortunadamente mi familia y yo fuimos del sector de trabajo afectado por el covid-19, somos comerciantes sin servicios médicos. Hemos agotado nuestros ahorros para poder subsistir estas últimas semanas, tengo 2 personas enfermas en la familia con diversos padecimientos como diabetes e hipertensión, y estoy en busca de insulina humana de acción intermedia y rápida, prazosin tabletas, losartan, metformina, metropolol y algo de alimentos ya no hay manera de conseguir otro empleo en estos momentos, apelamos a su buena voluntad y les agradezco de antemano por el apoyo que me puedan dar, Gracias y buen día",Iztapalapa
2020-04-05 11:04:38,803,-99.2134442,19.380748999999998,Farmacia,Demanda,Pendiente,Despensa Medicamentos Porque soy una persona de tercera edad mi esposo depende de mi ya que esta perdiendo la vista no contamos con ningun apoyo,Álvaro Obregón
2020-04-05 11:20:46,808,-99.17787879999999,19.547278600000002,Farmacia,Demanda,Pendiente,"Despensa y medicamentos como insulina humana de acción intermedia, gilbenclamida, hidrocloritiazida, losartan, metformina, metropolol, bezafibrato, atosbrastatina e hipromelosa  Ya soy mayor de edad, vivo con mi esposo que tiene 67 años, a él lo descansaron de su trabajo, trabaja en un estacionamiento , además que padece de la vista, vivimos de las propinas que le dan, yo soy diabética e hipertensa, ni tengo seguro y necesito medicina, me da miedo salir por los contagios, y necesitó alimento porque vivo al día y no tengo ahorros, agradecería que me consideraran en su fundación, muchas gracias Dios loa bendiga",Tlalnepantla de Baz
2020-04-05 03:27:22,891,-88.296146,18.5001889,Farmacia,Demanda,Pendiente,Para los supcidios Alimentación de mis hijos y medicamentos Para poder a sol ventar los gastos de mi servicios y alimentos de mis hijos,Othón P. Blanco
2020-04-05 04:52:14,921,-99.23699,19.2838297,Farmacia,Demanda,Pendiente,Apoyo económico y/o despensa Apoyo en medicamentos para ancianos (mis abuelos). Talvez apoyo en cuestión de formalización de negocios o créditos para los mismos. Mi familia y yo somos comerciantes por lo que nos hemos visto afectados y frenados en nuestro sustento diario,Tlalpan
2020-04-06 01:15:55,1039,-99.19779090000002,18.8533485,Farmacia,Demanda,Pendiente,Si El tiempo que me puedan apoyar ya que soy una persona discapacitado no puedo caminar y necesito para mí sondas y medicamento Apoyo de despensa por qué mi hijo se quedó sin empleo es el el que me apoya económica mente y lo que gana mi esposa horita no nos alcanza,Emiliano Zapata
2020-04-06 09:23:41,1047,-99.1303962,19.446823100000003,Farmacia,Demanda,Pendiente,Medicamentos  Mi madre tiene artereoesclerosis,Cuauhtémoc
2020-04-06 12:17:47,1083,-99.1774462,18.890867999999998,Farmacia,Demanda,Pendiente,Apoyo económico para poder alimentarnos y comprar medicamentos para mis padres díabeticos.  Mis papás y yo nos quedamos sin trabajo. Ya no podemos salir a vender nuestros productos. Mi padres tienen diabetes y necesitamos insulina.,Jiutepec
2020-04-06 02:32:20,1108,-99.2051355,18.892438000000002,Farmacia,Demanda,Pendiente,Para darle de comer a mis hijas y aterderlas de medicamento Para su futuro de estudios Dos niñas con discapacidad de cegera,Jiutepec
2020-04-06 03:15:06,1113,-99.1629131,19.3486926,Farmacia,Demanda,Pendiente,"Despensa de abarrotes, fruta y verdura, por favor Medicamento solicito apoyo para mi mamá (65 años) ya que no cuenta con ingresos, ella vende dulces, pero desde que entró la contingencia y el paro de actividades escolares dejó de sacar su puesto y su economía tanto como la mía se ha visto mermada ya que también le dio parálisis facial por estrés y tiene que recibir terapias de rehabilitación y tomar medicamentos, espero contar con su apoyo, también estoy preocupada por mi suegra (66 años) ella s una persona con diabetes y artritis reumatoide que igual no tiene ingresos, más que lo que sus hijos pueden aportarle, pero con esta situación algunos se quedaron descansados de sus empleos sin goce de sueldo, además de tener a su cargo un hijo con ezquizofrenia",Coyoacán
2020-04-06 06:07:52,1164,-99.1774462,18.890867999999998,Farmacia,Demanda,Pendiente,Comprar víveres y medicamentos  Comprar víveres y medicamentos,Jiutepec
2020-04-06 08:42:35,1192,-99.1871364,18.891859399999998,Farmacia,Demanda,Pendiente,"Despensa medicamentos para el control de azúcar Despensa y medicamentos para el azúcar Vendia tamales y las ventas disminuyeron considerablemente no hay gente en la calle, soy madre soltera y dependen dos menores de mi",Jiutepec
2020-04-07 09:17:40,1238,-92.93507609999999,18.022907,Farmacia,Demanda,Pendiente,Alimentos Medicamentos Estoy desempleada,Centro
2020-04-07 03:37:34,1314,-99.1539178,19.311586899999998,Farmacia,Demanda,Pendiente,"Alimentos por favor Linagliptina medicamento para diabetes Discapacidad visual y diabetes mellitus , 61 años",Coyoacán
2020-04-07 06:24:01,1347,-99.08337399999999,19.3342713,Farmacia,Demanda,Pendiente,Alimentos Medicamentos soy diabetica e hipertensa Me quede sin trabajo soy viuda,Iztapalapa
2020-04-07 06:59:54,1359,-99.01012990000001,19.3364415,Farmacia,Demanda,Pendiente,"Alimentos, medicamentos y dinero Ayuda para trabajar Tengo discapacidad y no tengo empleo",Iztapalapa
2020-04-08 02:25:07,1410,-99.20790500000001,19.357464399999998,Farmacia,Demanda,Pendiente,"Medicamento o despensa  Tengo artritis reumatoide y por el momento no encuentro medicamento para mi tratamiento uno de ellos es hidroxicloroquina y lefunomida soy madre soltera y la situación esta difícil,pago renta y tengo una pequeña de 3 años o si me podrían apoyar con alguna despensa se los agradecería",Álvaro Obregón
2020-04-08 05:40:21,1493,-99.16914129999999,19.4301322,Farmacia,Demanda,Pendiente,Requiere Despensa y medicamentos. Despensa y medicamentos Cuida a dos enfermos (un tiene amputada una pierna y la otra persona tiene cáncer en fase terminal),Cuauhtémoc
2020-04-08 06:01:36,1497,-98.20627270000001,19.041439800000003,Farmacia,Demanda,Pendiente,Alimento y medicamento Alimento y medicamento Ya no pude pagar la renta de mi local una estética..y tengo que cerrar,Puebla
2020-04-08 06:56:33,1515,-99.0267076,19.5419272,Farmacia,Demanda,Pendiente,"Ayuda economica para poder comprar medicamentos, alimentos.
O la ayuda que puedan proporcionar, cual sea seria excelente.  Soy madre de dos pequeños,mi hija de 8 años esta enferma es epileptica, tiene malformaciones congenitas en manos y pies y retraso en su desarrollo,pie equino y etc...requiere atencion medica, medicinas etc...y mi hijo es asmatico.
Yo no trabajo, tengo que pagar renta comida y en verdad necesito ayuda",Ecatepec de Morelos
2020-04-09 01:20:31,1587,-88.3178568,18.5284851,Farmacia,Demanda,Pendiente,Alimentos pañales medicamentos pago de mi renta y servicios Pago de servicios No tengo empleo soy madre soltera tengo dos hijos y un adulto mayor dependen de mi,Othón P. Blanco
2020-04-09 04:22:16,1604,-88.3178568,18.5284851,Farmacia,Demanda,Pendiente,Alimentos y medicamentos Pago de servicios y mensualidad de casa Por que soy madre soltera y tengo 4hijos y tengo un bebe de meses,Othón P. Blanco
2020-04-09 06:29:48,1612,-88.3178568,18.5284851,Farmacia,Demanda,Pendiente,Alimentos y medicamentos. Pago de servicio y mensualidad de casa. Decempleado.,Othón P. Blanco
2020-04-09 06:29:52,1613,-88.3178568,18.5284851,Farmacia,Demanda,Pendiente,Alimentos y medicamentos Pago de servico y mensualidad de casa Por que soy madre soltera y tengo 2 hijos y una nieta,Othón P. Blanco
2020-04-10 12:31:52,1677,-92.93507609999999,18.022907,Farmacia,Demanda,Pendiente,Despensa Medicamento Por qué ahorita no puedo salir de casa a trabajar y no estoy recibiendo un salario,Centro
2020-04-10 07:58:45,1715,-99.5311939,18.3280249,Farmacia,Demanda,Pendiente,Para comprar alimentos y medicamentos Para comprar alimentos y medicamentos Me quedé sin empleopara,Iguala de la Independencia
2020-04-12 02:16:31,1798,-99.098584,19.432217899999998,Farmacia,Demanda,Pendiente,"Requiero paracetamol de 500mg y Tramadol de liberación prolongada de 100mg Pues medicamentos Soy persona con discapacidad y estoy en tratamiento médico, solo vivimos mi mamá y yo y ella ya adulta mayor y el día de ayer amanecí con molestias de resfriado, ya no quiero ir a la farmacia, por miedo a que vaya a estar contagiada, ya me hice el test covid-19.",Venustiano Carranza
2020-04-12 09:36:21,1802,-99.0073673,19.4102526,Farmacia,Demanda,Pendiente,"Alimentos de canasta básica, yo también puedo apoyar con medicamentos a quien los necesite  Desempleada sin goce de prestaciones y sueldo",Nezahualcóyotl
2020-04-12 11:40:21,1809,-99.11932970000001,19.6448521,Farmacia,Demanda,Pendiente,Despensa Despensa y medicamentos Estoy desempleada,Coacalco de Berriozábal
2020-04-12 03:17:15,1818,-99.17813829999999,19.2330537,Farmacia,Demanda,Pendiente,"Apoyo con despensa para mi y mi esposa Medicamento para mi esposa, es paciente del Instituto Nacional de Psiquiatría y requiere 2 medicamentos para su padecimiento Trabajo por mi cuenta como carpintero desde mi casa y con la pandemia he perdido trabajo que tenia por realizar. Debido a la naturaleza de mi oficio la gente me ha dicho que por el momento la prioridad son los gastos de alimentación y servicios de sus casas.",Tlalpan
2020-04-12 05:03:45,1823,-98.9499973,19.8957317,Farmacia,Demanda,Pendiente,Medicamento y comida Medicamento Sin empleo,Tizayuca
2020-04-12 08:54:27,1839,-99.00874859999999,19.6091596,Farmacia,Demanda,Pendiente,"Algo de despensa o un apoyo para comprarla , padesco de migraña y no tengo medicamentos .. Si pudiera ingresar al programa de algún apoyo del gobierno Porque vivo sola con mis dos hijos y vivía de la ventas que hacía ya no hay ventas y no he podido conseguir un empleo",Ecatepec de Morelos
2020-04-12 09:18:53,1843,-99.0709315,19.392349499999998,Farmacia,Demanda,Pendiente,Alimentos Medicamentos Me quedé sin ingresos.,Iztacalco
2020-04-13 01:13:30,1886,-99.79225090000001,18.5001186,Farmacia,Demanda,Pendiente,Ayudar con los gastos de casa y medicamentos de mi papá Mi renta de cuarto en donde estudió Me quedé sin trabajo y mi papá está enfermo y quiero ayudarlo,Ixcateopan de Cuauhtémoc
2020-04-13 05:04:19,1902,-99.1968277,19.3963215,Farmacia,Demanda,Pendiente,Despensa y medicamento  Es para una abuelita que se quedo sin empleo ni ayuda por parte del gobierno pues hicieron cambio de tarjetas para los abuelitos la traen vuelta y vuelta no le den su ayuda ella trabaja en un mercado de xochimilco se llama Mercedes Varela Ledesma tiene 77años su numero de cel es 5578358762 Lamentablemente mi negocio se cerró por falta de pago en renta y quisiera ayudarla con algo más creo que este proyecto podrán ayudarle la abuelita pues es sola me preocupa mucho.,Miguel Hidalgo
2020-04-13 06:37:24,1915,-92.90948159999999,17.9959062,Farmacia,Demanda,Pendiente,"Apoyo económico para poder subsistir en esta temporada de escasez. Medicamentos (clonazepam,sertalina,comenter) quién solicita padece de depresión ,ansiedad y agorafobia. Nos encontramos en una situación en la que mi madre debido a su enfermedad (neuropatía diabetica) no puede trabajar, yo (su hija) solía hacer paletas para vender, cosa que deje de hacer por la presente situación del covid-19; yo quién también me encuentro estudiando mas nunca he recibido ningún apoyo por parte del gobierno. Por obviedad no está llegando ningún ingreso a casa y necesitamos apoyo para adquirir lo necesario aquí en el hogar.",Centro
2020-04-14 08:04:16,1996,-99.2058279,19.449630499999998,Farmacia,Demanda,Pendiente,Alimentos y medicamento Un trabajo No tengo solvencia económica,Miguel Hidalgo
2020-04-14 08:10:06,1997,-99.2058279,19.449630499999998,Farmacia,Demanda,Pendiente,Alimentos y medicamento Un trabajo estable Porque no tengo solvencia económica no hay ingresos,Miguel Hidalgo
2020-04-18 02:28:28,2256,-88.3178568,18.5284851,Farmacia,Demanda,Pendiente,Alimentos medicamentos Pago de servicio y mensualidad de pago de renta Pago de renta servicios pañales alimentos  medicamentos ,Othón P. Blanco
2020-04-18 04:16:43,2261,-98.11747209999999,19.61766,Farmacia,Demanda,Pendiente,"Requiero comida Comida y medicamento  Vivo sola, estoy enferma, bipolar y alta presión ",Tlaxco
2020-04-19 06:45:37,2377,-98.26687290000001,19.0296808,Farmacia,Demanda,Pendiente,"Una cesta de comida  Comida y medicamentos  Soy paciente con lupus y ya tengo 2 meses sin salir, no tengo empleo y pues tomo muchos medicamentos, para la presión, tiroides, ",San Andrés Cholula
2020-04-24 04:55:23,2479,-95.52400250000001,18.0179491,Farmacia,Demanda,Resuelta,"Necesitamos material de protección para personal médico, enfermeras y paramédicos del hospital regional de Isla, Veracruz.
",Isla
2020-04-24 23:18:57,2524,-98.22173417,19.01473331,Farmacia,Demanda,En progreso,unas cervezas,Puebla
2020-04-27 20:56:57,2697,-101.3443471,20.64829207,Farmacia,Demanda,Resuelta,"Jeringas para insulina y material de curación para la herida de mi pie gasa , vendas y cinta adhesiva. Tengo diabetes tipo 2 desde hace 20 años y acabo de sufrir un infarto al inicio del 2020 y tengo una amputación de tres dedos de mi pie. ",Irapuato
2020-04-27 22:31:51,2706,-99.13039752,19.44682368,Farmacia,Demanda,Resuelta,Mi madre tiene artereoesclerosis. Dios los bendiga. ,Cuauhtémoc
2020-04-06 19:49:27,29,99.13824002,19.41987832,Apoyo Psicológico,Oferta,Resuelta,"Como cuidador de personas adultas mayores, puedo apoyar a estas personas, vía telefónica. ",other
2020-04-07 10:39:17,39,-98.99561226,19.22124641,Apoyo Psicológico,Oferta,Resuelta,No estás solo (a),Tláhuac
2020-04-07 14:34:11,44,-99.09832481,19.35794142,Apoyo Psicológico,Demanda,En progreso,"Había iniciado terapia hace unas semanas por ansiedad en la escuela, ahora mismo no pude seguir y no he encontrado un lugar donde me sienta cómoda para seguir con esto.",Iztapalapa
2020-04-07 23:12:37,51,-102.0020663,23.82293463,Apoyo Psicológico,Oferta,Resuelta,"Especialista en trabajo con Trauma, atiendo a adolescentes y adultos. ",Mazapil
2020-04-08 01:37:29,53,-99.08498481,19.36446593,Apoyo Psicológico,Oferta,Resuelta,"Por redes, x llamada, si estas desesperado o sufres x algo  aqui estoy ",Iztapalapa
2020-04-08 13:10:55,58,-98.26249396,19.05806186,Apoyo Psicológico,Oferta,Resuelta,Atención en crisis,Puebla
2020-04-08 14:07:52,59,-101.22654140000002,20.90509563,Apoyo Psicológico,Oferta,Resuelta,"Si sientes desesperación, desesperanza, ansiedad, depresión, enojo, o alguna emoción que te incómoda, con gusto podemos platicar y definitivamente cambiar éstas emociones.",Guanajuato
2020-04-08 14:32:08,60,-99.0984625,19.35907515,Apoyo Psicológico,Oferta,En progreso,Soy psicóloga he leído tu solicitud indicame como puedes contactarme,Iztapalapa
2020-04-08 23:21:25,66,-99.0802002,19.03615612,Apoyo Psicológico,Oferta,Resuelta,"Soy psico orientadora puedo atender por teléfono
Utilizo enfoque centrado en la persona, Gestalt, terapia breve y conductual
Además soy bioquímica por si tienen dudas respecto a COVID",Tepoztlán
2020-04-09 13:06:10,72,99.13656633,19.42457321,Apoyo Psicológico,Oferta,Resuelta,Ofrezco mi ayuda para apoyar psicológicamente a personas adultas mayores. ,other
2020-04-02 10:29:10,122,-81.7677645,26.2422984,Apoyo Psicológico,Oferta,Pendiente,Apoyo psicológico en linea via whatts app,other
2020-04-03 09:22:11,183,-99.133208,19.4326077,Apoyo Psicológico,Oferta,Pendiente,Atención psicológica  No soy donador en especie,Cuauhtémoc
2020-04-11 09:12:23,446,-99.0667845,19.4677043,Apoyo Psicológico,Oferta,Pendiente,"Dar asesoria academica  capacitacion escolar,academica  y psicologica.Soy pedagoga",Gustavo A. Madero
2020-04-15 17:09:22,495,99.13877278,19.42369402,Apoyo Psicológico,Oferta,Resuelta,"Sesiones de coaching, para hablar desde lo que te importa",other
2020-04-15 19:45:52,497,-99.14641969,19.43627196,Apoyo Psicológico,Oferta,Resuelta,"Ofrezco apoyo y acompañamiento psicológico a personas con Discapacidad Intelectual, autismo, psicosis. Quedó a sus órdenes .   ",Cuauhtémoc
2020-04-19 14:41:40,526,-90.47893524,19.85936397,Apoyo Psicológico,Oferta,Resuelta,Somos un colectivo y contamos con psicólogos los cuales pueden brindar ayuda a las personas que lo soliciten. ,Campeche
2020-04-19 14:43:52,527,-90.47780688,19.85458211,Apoyo Psicológico,Oferta,Resuelta,Contamos con psicólogos para brindar apoyo,Campeche
2020-04-02 12:19:43,589,-99.138575,19.3418112,Apoyo Psicológico,Demanda,Pendiente,"Psicológico Psicológico si esque aplica, no sé cuánto vaya a durar esto Atención psicológica. Ya estaba tomando terapia, pero tras la pandemia y el distanciamiento social deje de acudir, y la situación ha acrecentado mis estabilidad emocional",Coyoacán
2020-04-02 08:00:06,613,-104.90749479999998,21.5094507,Apoyo Psicológico,Demanda,Pendiente,Atención psicológica  Crisis de ansiedad,Tepic
2020-04-19 09:00:34,2303,-99.31876120000001,19.354755800000003,Apoyo Psicológico,Demanda,Pendiente,"Apoyo psicológico para saber cómo puedo manejar está situación   Porque he tenido crisis de ansiedad, no se cómo manejar el encierro, he tenido alteraciones de sueño y ya me está afectando físicamente ",Cuajimalpa de Morelos
2020-04-27 07:12:33,2584,-99.1680238,19.3813639,Apoyo Psicológico,Oferta,Resuelta,Hablar con gente que lo necesite,Benito Juárez
2020-04-27 07:22:16,2644,-99.1774462,19.4149803,Apoyo Psicológico,Oferta,Resuelta,Escucho a la gente de 15 a 20 minutos 3 veces por semana para q no se sientan solos y se desahoguen.,Cuauhtémoc
2020-04-27 07:22:47,2645,-99.1854059,19.4326224,Apoyo Psicológico,Oferta,Resuelta,Apoyando personas q estén pasando un momento difícil,Miguel Hidalgo
2020-04-27 07:25:31,2667,-99.146999,19.345811899999998,Apoyo Psicológico,Oferta,Resuelta,"Psicoterapia psicoanalítica, intervención en crisis, apoyo psicológico a niños, adolescentes y adultos dirigido a integrar y tramitar las experiencias y emociones complicadas para que las personas puedan vivir mejor.",Coyoacán
2020-04-06 17:51:35,20,-99.53395669,19.2645122,Apoyo Legal,Oferta,Resuelta,Me pongo a sus órdenes ,San Mateo Atenco
2020-04-06 23:07:20,33,-98.19951426,19.00965138,Apoyo Legal,Oferta,Resuelta,"Derecho civil, mercantil y familiar",Puebla
2020-04-09 13:53:33,75,-100.8502257,22.09012427,Apoyo Legal,Demanda,Resuelta,"Tengo una isla en centro comercial , ayer nos cerraron la plaza y hoy me están solicitando la renta del mes . 
No puedo proceder legalmente ? 
Qué opción tengo como arrendador en centro comercial ? 

Alguien que me pueda orientar por fa",San Luis Potosí
2020-04-09 17:53:37,77,-99.04895752,19.39016602,Apoyo Legal,Oferta,En progreso,"Asesorías en materia penal, familiar y laboral ",Iztapalapa
2020-04-10 00:20:22,80,-84.51479686,33.99609576,Apoyo Legal,Oferta,Resuelta,Esta es una prueba,other
2020-04-10 13:56:15,88,-98.27656907,19.08435697,Apoyo Legal,Oferta,Resuelta,Asesoría jurídica sin costo. Apoyo en trámites y orientación en materia familiar y fiscal  gratuita a personas físicas y morales ,Cuautlancingo
2020-04-02 06:41:43,150,-99.2023662,19.443177600000002,Apoyo Legal,Oferta,Pendiente,Mezcla de ambas  Solo si hay un permiso legal para transportarlo ,Miguel Hidalgo
2020-04-03 03:55:58,207,-106.10958020000001,28.6407291,Apoyo Legal,Oferta,Pendiente,"Asesoramiento Legal Empresarial (consultoría remota, curso, taller, webinar)",Chihuahua
2020-04-09 10:46:08,402,-99.10549859999999,19.336111,Apoyo Legal,Oferta,Pendiente,Asesoría legal Asesoría vía remota y/o presencial,Iztapalapa
2020-04-19 10:39:38,524,-99.17091434,19.37060998,Apoyo Legal,Oferta,Resuelta,"Apoyo Legal y Administrativo para estrategias durante y después del COVID-19 (para ONGS, MIPYMES)",Benito Juárez
2020-04-06 10:57:41,1215,-99.2044432,19.6338747,Apoyo Legal,Demanda,Pendiente,"Alimentos y apoyo económico. Asesoría legal. Trabajo en escuela, limpiando el plantel. Cerraron por la contingencia y no encuentro otro trabajo. Además sufro violencia intrafamiliar. Ya hice la denuncia.",Cuautitlán Izcalli
2020-04-24 04:36:32,2478,-96.1381188,19.1762597,Apoyo Legal,Oferta,Resuelta,"Asistencia Legal para Trabajadores y Madres Solteras para el Trámite de Pensión por Alimentos.
",Veracruz
2020-04-26 14:32:19,2553,-101.1767207,19.68856396,Apoyo Legal,Demanda,Resuelta,Alguien que pueda orientar acerca del préstamo a Pymes que está dando el Gobierno. Ya que tengo muchas personas allegadas que podría ayudarles en su negocio.,Morelia
2020-04-27 07:23:05,2650,-104.63692040000001,24.043294600000003,Apoyo Legal,Oferta,Resuelta,Asesoría legal en materia laboral y de amparo para empresas y trabajadores.,Durango
2020-04-02 09:24:27,121,-99.12417109999998,19.415460999999997,Efectivo,Oferta,Pendiente,Efectivo Ayuda en efectivo,Venustiano Carranza
2020-04-02 11:51:49,126,-87.6679765,41.7470143,Efectivo,Oferta,Pendiente,Efectivo,other
2020-04-02 04:28:13,138,-101.1999657,20.5721858,Efectivo,Oferta,Pendiente,"Efectivo Quiero ayudar en efectivo o transferencia, dígame donde puedo hacerlo.",Salamanca
2020-04-02 05:12:49,143,-100.2572084,25.781478600000003,Efectivo,Oferta,Pendiente,Efectivo Carro,Apodaca
2020-04-02 05:23:00,144,-99.10134980000001,18.6813049,Efectivo,Oferta,Pendiente,Efectivo Es en efectivo o especie ,Tlaltizapán
2020-04-02 05:33:08,145,-99.161404,19.3768168,Efectivo,Oferta,Pendiente,"Efectivo No es donación en especie. Puedo donar en efectivo, realizando una transferencia. ",Benito Juárez
