timestamp,event_id,longitude,latitude,tipo,economia,atencion,mensaje,municipio
2020-04-05 12:13:27,819,-98.2404397,19.2076994,Otro,Demanda,Pendiente,"Despen2  Solicitó su ayuda para alimentos, mi familia y yo estamos desempleados nos quedamos sin trabajo devido al covid-19 somos comerciantes de dulces vivimos al dia no tenemos para comer ya que la situación cada dia esta peor esperó que nos puedan ayudar tengo a mi bebe y no tengo para darle de comer . Porfavor",Zacatelco
2020-04-05 12:18:12,821,-106.383174,23.2625165,Otro,Demanda,Pendiente,"Despensa Ayuda económica para renta Me quedé sin trabajo por la cuarentena , se cerró la tienda por falta de turismo",Mazatlán
2020-04-05 12:21:40,823,-99.0640199,19.293989399999997,Otro,Demanda,Pendiente,Comida  No cuento con empleo,Iztapalapa
2020-04-05 12:24:23,826,-106.383174,23.2625165,Otro,Demanda,Pendiente,Despensa Ayuda para pagar renta Cierre de tienda por cuarentena,Mazatlán
2020-04-05 12:29:23,827,-99.0674757,19.5465132,Otro,Demanda,Pendiente,Despensa  No tengo trabajo,Ecatepec de Morelos
2020-04-05 12:30:28,828,-99.1968277,18.9517043,Otro,Demanda,Pendiente,Largo Largo Alimentación,Cuernavaca
2020-04-05 12:33:17,829,-99.60177840000001,18.561941100000002,Otro,Demanda,Pendiente,Medidas de alimentación  Para poder yevar un sustento Ami casa y tener una ayuda para mí núcleo familiar,Taxco de Alarcón
2020-04-05 12:41:53,830,-99.1968277,18.9517043,Otro,Demanda,Pendiente,Alimentación  Medidas de alimentación,Cuernavaca
2020-04-05 12:48:03,832,-99.1802147,18.867191100000003,Otro,Demanda,Pendiente,Corto plazo Mediano plazo Desempleo,Jiutepec
2020-04-05 12:59:25,833,-99.133208,19.4326077,Otro,Demanda,Pendiente,Alguien con quien hablar  Necesito ayuda psicologica estoy sufriendo ataques de ansiedad e insomnio,Cuauhtémoc
2020-04-05 01:00:27,834,-99.0654022,19.4103067,Otro,Demanda,Pendiente,Si Si No ay ingresos ya que despidieron a los que aportan el alimentos,Iztacalco
2020-04-05 01:05:18,836,-99.0191091,19.5194617,Otro,Demanda,Pendiente,Me quede sin trabajo  Mamá soltera costurera no hay trabajo,Ecatepec de Morelos
2020-04-05 01:06:39,837,-99.0640199,19.293989399999997,Otro,Demanda,Pendiente,Alimento durante la cuarentena  Estoy desempleado debido a la contingencia,Iztapalapa
2020-04-05 01:06:40,838,-99.0640199,19.293989399999997,Otro,Demanda,Pendiente,Alimento  El establecimiento don laboró cerró,Iztapalapa
2020-04-05 01:08:55,839,-99.6132583,18.5426307,Otro,Demanda,Pendiente,Como dos meses No aplica Estoy Desempledo,Taxco de Alarcón
2020-04-05 01:09:34,841,-99.1556476,19.4724349,Otro,Demanda,Pendiente,Pues en estos tiempos lo q c pueda es bueno Pues si uviera algo q pueda hacer con mi carro yo puedo trabajar sin problema Soy chofer de Uber y mi trabajo a bajado hasta un 70%,Azcapotzalco
2020-04-05 01:13:22,843,-99.2189838,19.542509399999997,Otro,Demanda,Pendiente,Dinero Una ayuda mensual Tengo 3 hijos (uno con discapacidad) y mi esposo no le están pagando.,Tlalnepantla de Baz
2020-04-05 01:14:16,844,-99.2085974,19.393514800000002,Otro,Demanda,Pendiente,Comprar víveres Comprar material de apoyo para la educación de ni hija Desempleo,Miguel Hidalgo
2020-04-05 01:16:28,845,-99.19561929999999,18.8303457,Otro,Demanda,Pendiente,Si Si DESPENSA DEL OGAR,Emiliano Zapata
2020-04-05 01:18:59,846,-98.982146,19.6860924,Otro,Demanda,Pendiente,Ayuda económica ya que por el momento no cuento con ingresos al estar Desempleado Me gustaría de ser posible Ayuda para un negocio Mayor de 60 años Desempleado,Tecámac
2020-04-05 01:28:31,847,-99.19561929999999,18.8303457,Otro,Demanda,Pendiente,El que m quieran dar A un año y medio Estamos descansando sin sueldo,Emiliano Zapata
2020-04-05 01:33:35,848,-99.2037508,18.808656399999997,Otro,Demanda,Pendiente,sin trabajo mediano por que me quede sin trabajo,Emiliano Zapata
2020-04-05 01:36:05,851,-99.2016738,18.8139073,Otro,Demanda,Pendiente,"Si Si Me dedico a la agricultura junto con mi padre que es de la tercera edad lo que coseche, no pude venderlo debido a que los negocios están cerrados y lo que vendí mi cliente no pudo vender y yo recuperar.
Necesito herbicidas, abono y semilla para volver a sembrar.",Emiliano Zapata
2020-04-05 01:37:03,852,-103.3045911,20.684387899999997,Otro,Demanda,Pendiente,Gasolina para moverme Alguna compensación Quiero apoyar a este movimiento,Guadalajara
2020-04-05 01:55:58,854,-92.93507609999999,17.9755405,Otro,Demanda,Pendiente,"Canasta básica Pues padezco de hipertensión Soy una persona de la 3ra edad, y mi hijo se quedo sin trabajo",Centro
2020-04-05 01:58:01,855,-99.60177840000001,18.561941100000002,Otro,Demanda,Pendiente,"Surtir alimentos Tener economía para cualquier emergencia Soy de bajos recursos y solo vivo
Con mi mamá",Taxco de Alarcón
2020-04-05 02:02:25,856,-99.1968277,18.9517043,Otro,Demanda,Pendiente,Si requiero apoyo  Me quede sin empleo,Cuernavaca
2020-04-05 02:04:58,858,-99.1968277,18.9517043,Otro,Demanda,Pendiente,No tengo sueldo A corto plazo Por que me quede sin empleo,Cuernavaca
2020-04-05 02:05:59,859,-97.92518929999999,19.310840399999996,Otro,Demanda,Pendiente,Despensa alimenticia Mediano plazo Porque tengo a mi mama en tratamiento de cancer y ella es viuda de 69 años y acabo de salir mi hijo de un cancer leucemia linfoblastica aguda pre b de alto riesgo el cual empezo cuando tenia 4 años en el 2015 que tuvo mi hijo de 9 años ahora por lo que los gastos han sido demasiado fuertes y yo solo me dedico a las ventas pero por la situacion en la que vivimos no hay venta por eso pido me tomen en cuenta en esta ayuda de antemano muchas gracias,Huamantla
2020-04-05 02:07:53,860,-99.1968277,18.9517043,Otro,Demanda,Pendiente,Si  Me quede sin trabajo,Cuernavaca
2020-04-05 02:11:09,861,-93.0889312,16.787414300000002,Otro,Demanda,Pendiente,Dos meses  Alimentación,Tuxtla Gutiérrez
2020-04-05 02:17:41,862,-99.5311939,18.3280249,Otro,Demanda,Pendiente,Alimentación Mediano Alimentación,Iguala de la Independencia
2020-04-05 02:19:53,863,-99.6132583,18.5426307,Otro,Demanda,Pendiente,Corto plazo Mediano Para alimentacion,Taxco de Alarcón
2020-04-05 02:23:16,864,-99.6132583,18.5426307,Otro,Demanda,Pendiente,Corto plazo Mediano Alimentacion,Taxco de Alarcón
2020-04-05 02:27:06,865,-99.082337,19.473186399999996,Otro,Demanda,Pendiente,Despensa Despesa Apoyo de Despensa,Gustavo A. Madero
2020-04-05 02:31:13,867,-99.1968277,18.9517043,Otro,Demanda,Pendiente,Cortó plazo Mediano plazo Necesito el apoyo por qué no estoy trabajando,Cuernavaca
2020-04-05 02:31:25,868,-99.1334637,19.4213174,Otro,Demanda,Pendiente,"Comida , gas , medicina y pañales de adulto Celebrex , gabapentina , metformina losartan y gel de diclofenaco Mi hija se quedó sin trabajo y son tiempos difíciles",Cuauhtémoc
2020-04-05 02:31:51,869,-99.5716848,19.3153047,Otro,Demanda,Pendiente,Solamente ayuda para la alimentacion  Mi esposo es conductorcde Uber y no hay trabajo y no sale para nuestro día a día tiene 64 años y es hipertenso sale a trabajar con temor por ser vulnerable al contagio,Toluca
2020-04-05 02:32:29,870,-99.5311939,18.3280249,Otro,Demanda,Pendiente,Urgente A largo plazo Viuda y estoy desempleada,Iguala de la Independencia
2020-04-05 02:36:36,871,-99.5311939,18.3280249,Otro,Demanda,Pendiente,Corto plazo De mediano plazo Por que mis hijas depende mi soy madres soltera,Iguala de la Independencia
2020-04-05 02:36:55,872,-99.5311939,18.3280249,Otro,Demanda,Pendiente,Alimentación Mediano Madre soltera,Iguala de la Independencia
2020-04-05 02:42:16,875,-98.89327340000001,19.300955399999996,Otro,Demanda,Pendiente,"Un préstamo o una despensa A largo plazo Por el COVID19, Me quedé sin empleo",Ixtapaluca
2020-04-05 02:44:33,876,-93.1829868,16.7167712,Otro,Demanda,Pendiente,si si me quedé sin empleo y me hago cargo de una hermana y su hijo,Tuxtla Gutiérrez
2020-04-05 02:52:23,877,-99.6132583,18.5426307,Otro,Demanda,Pendiente,corto plazo mediano economia,Taxco de Alarcón
2020-04-05 02:56:38,879,-99.6132583,18.5426307,Otro,Demanda,Pendiente,corto mediano falta de economia,Taxco de Alarcón
2020-04-05 03:01:54,880,-99.25777149999999,19.4757031,Otro,Demanda,Pendiente,Despensa A corto plazo Porque me descansaron en mi trabajo no estoy generando y tengo 3 hijos.,Naucalpan de Juárez
2020-04-05 03:05:22,883,-99.133208,19.4326077,Otro,Demanda,Pendiente,Víveres  Para apoyar con despensas a personas de mi colonia que viven al día,Cuauhtémoc
2020-04-05 03:08:33,884,-99.1802147,18.867191100000003,Otro,Demanda,Pendiente,Apoyo economico para vender Ayuda economica para pagar gas Soy viuda y no tengo trabajo y vende comida y no tengo para mis insumos,Jiutepec
2020-04-05 03:12:48,885,-89.6604593,21.281181399999998,Otro,Demanda,Pendiente,Apoyo economico Apoyo economico Falta de trabajo y tengo una niña pequeña,Progreso
2020-04-05 03:15:50,887,-89.6604593,21.281181399999998,Otro,Demanda,Pendiente,Yo requiero apoyo económico Apoyo económico Me quede sin empleo por cierre de la oficina donde trabajaba por la contingencia,Progreso
2020-04-05 03:16:10,888,-99.5311939,18.3280249,Otro,Demanda,Pendiente,Corto plazo Mediano Desempleada,Iguala de la Independencia
2020-04-05 03:20:02,889,-99.23560479999999,18.9203462,Otro,Demanda,Pendiente,Apoyo  Por desempleo por covid 19,Cuernavaca
2020-04-05 03:21:29,890,-99.1553016,18.8890199,Otro,Demanda,Pendiente,Despensa Dinero No tengo trabajo por el COVID-19,Jiutepec
2020-04-05 03:27:35,892,-89.6463452,21.030772100000004,Otro,Demanda,Pendiente,1500 3500 Contingencia,Mérida
2020-04-05 03:31:43,895,-99.0895959,19.5056089,Otro,Demanda,Pendiente,El que sea  No tengo empleo y mi esposo se dedica al comercio informal en la calle y no puede salir por la contingencia,Gustavo A. Madero
2020-04-05 03:32:02,896,-99.1608372,18.906403,Otro,Demanda,Pendiente,6 mesesEl El que me indiquen Pago Renta,Jiutepec
2020-04-05 03:32:53,897,-98.7565074,20.055211,Otro,Demanda,Pendiente,"El manejo de los gastos de alimentación y la renta del lugar de trabajo y el próximo parto de mi nuera para esta semana que viene según los médicos. Ya que ella tampoco ha podido atenderlo por esta situación tan caótica que estamos pasando. Desempeño laboral y la oportunidad de resurgir en el trabajo para regularizar todo. Desempleo y de mi depende la familia y mi nuera que esta por parir y esto se ha ido complicando día con día, que esta pasando esta pandemia, ademas de tener un adeudo que no me a sido posible cubrir en tiempo y forma por la falta de poder laborar.",Mineral de la Reforma
2020-04-05 03:34:37,899,-99.0895959,19.5056089,Otro,Demanda,Pendiente,Lo que sea  No tengo empleo tengo deabetes y mi esposo es chófer y no ha tenido casi nada de trabajo.,Gustavo A. Madero
2020-04-05 03:35:34,900,-99.4988022,17.5458486,Otro,Demanda,Pendiente,"Espero que si! Y mejore mi situación No, espero salir lo pronto posible Tengo un mes sin trabajo tengo un pequeño negocio de salón de belleza pero con todo lo sucedido del virus, me he acabado mis ahorros aparte de pagar rentas de casa y negocio. Estoy desesperada por falta de trabajo con las ganas también de apoyar porque cuando se ha necesitado lo he hecho pero esta vez me siento débil, preocupada y desesperada por ya no tener nada en la despensa.",Chilpancingo de los Bravo
2020-04-05 03:37:41,901,-99.61743320000001,19.2847451,Otro,Demanda,Pendiente,Canasta básica y croquetas  Es probable quedarme sin trabajo,Toluca
2020-04-05 03:49:53,903,-99.1246541,19.389132699999998,Otro,Demanda,Pendiente,Apoyo economico Solo apoyo hasta el 30 de abril que puedo reabrir mi negocio Desempleo por contingencia,Iztacalco
2020-04-05 04:08:46,905,-99.536755,18.3453603,Otro,Demanda,Pendiente,Alimentación Mediano Soy artesano y no hay ventas,Iguala de la Independencia
2020-04-05 04:11:51,906,-96.91085140000001,19.5356117,Otro,Demanda,Pendiente,2500 10000 Desempleo,Xalapa
2020-04-05 04:12:40,907,-96.8846971,19.5432673,Otro,Demanda,Pendiente,3000 15000 Desempleo,Xalapa
2020-04-05 04:13:25,908,-99.1553016,18.8890199,Otro,Demanda,Pendiente,Un apoyo economico para poder comprar algo de despensa y un poco de croquetas para mis dos perritos también o abonar para mí renta  No tengo trabajo desde hace un mes y soy madre soltera,Jiutepec
2020-04-05 04:15:44,909,-99.07576999999999,19.6168428,Otro,Demanda,Pendiente,"$1,000 $5,000 Me quedé sin trabajo por la contingencia",Ecatepec de Morelos
2020-04-05 04:16:24,910,-99.16914129999999,18.903049600000003,Otro,Demanda,Pendiente,Corto plazo Mediano Para gastos en el hogar,Jiutepec
2020-04-05 04:23:00,911,-99.2037508,18.808656399999997,Otro,Demanda,Pendiente,Y necesito ayuda ya q no puedo salir a buscar trabajo Mi diabetes es mellitus 2 ya tengo varios años con ella y no quiero arriesgarme a salir No tengo trabajo y uso insulina mix 25,Emiliano Zapata
2020-04-05 04:28:09,912,-99.23144920000001,18.7955184,Otro,Demanda,Pendiente,"Pues aunque sea algo para comprar despensa para este mes tan difícil  Yo vivo rentando casas de fin de semana de terceras personas. Todas las rentas que tenía para el mes de marzo y abril se cancelaron y me quedé en cero ingresos. Mi esposo es chofer de publicidad y lo descansaron, le están dando la mitad de la quincena (1,700 pesos) y pues no nos alcanza para nada. Tengo tres hijos y ya no sé qué más hacer.",Xochitepec
2020-04-05 04:34:01,915,-99.19821230000001,18.9266215,Otro,Demanda,Pendiente,C Mediano plazo Tengo que pagar un préstamo,Cuernavaca
2020-04-05 04:37:46,917,-99.19821230000001,18.9266215,Otro,Demanda,Pendiente,Mediano plazo Mediano plazo Pagar deudas,Cuernavaca
2020-04-05 04:42:27,918,-99.152534,19.336695600000002,Otro,Demanda,Pendiente,Diez mil pesos Veinte mil pesos Tenia trabajo irregunar y con ingresos minimos. Ahora con la crisis no tengo ningun ingreso,Coyoacán
2020-04-05 04:43:02,919,-99.19405859999999,19.4612777,Otro,Demanda,Pendiente,Despensa Economico Soy madre de dos chicos y comerciante x lo del covi no puedo salir a vender y de mi dependen mis hijos mi hijo mayor tiene discapacidad intelectual y mi hija esta embarazada su pareha no le respondio y estoy desesperada x eso me atrevo a pedir de su apoyo,Miguel Hidalgo
2020-04-05 04:46:35,920,-99.22156590000002,18.9242095,Otro,Demanda,Pendiente,Para sustento de mi familia  Apoyo Para el sustento de mi familia,Cuernavaca
2020-04-05 05:02:04,922,-99.1774462,18.890867999999998,Otro,Demanda,Pendiente,Apoyo económico Apoyo económico Estoy desempleada,Jiutepec
2020-04-05 05:03:24,923,-99.1774462,18.890867999999998,Otro,Demanda,Pendiente,Si Si Estoy desempleada,Jiutepec
2020-04-05 05:06:09,924,-99.1774462,18.890867999999998,Otro,Demanda,Pendiente,Lo Mas Pronto Posible mediano Por Economia,Jiutepec
2020-04-05 05:06:22,925,-99.1303962,19.446823100000003,Otro,Demanda,Pendiente,5 meses 7 meses No tengo trabajo y el papá de mi hija no me ayuda,Cuauhtémoc
2020-04-05 05:10:56,926,-99.1483827,18.8820045,Otro,Demanda,Pendiente,$700 Mediano Por gastos del hogar,Jiutepec
2020-04-05 05:17:48,927,-99.19561929999999,18.8303457,Otro,Demanda,Pendiente,Corto plazo  Para comer,Emiliano Zapata
2020-04-05 05:18:25,928,-99.2383753,18.8260616,Otro,Demanda,Pendiente,Corto plazo Mediano plazo Desempleado y enfermo diabetes,Temixco
2020-04-05 05:20:22,930,-96.3678174,16.9165926,Otro,Demanda,Pendiente,"Apoyo en especie Apoyo económico Me dedico a la producción de ropa artesanal y mis ingresos han sido afectados por la contingencia, los insumos están por terminarse.",San Pablo Villa de Mitla
2020-04-05 05:25:04,931,-99.1802147,18.867191100000003,Otro,Demanda,Pendiente,Si Si Para despensa y mi renta y tareas,Jiutepec
2020-04-05 05:26:34,932,-96.3678174,16.9165926,Otro,Demanda,Pendiente,"Despensa Algún apoyo económico Hace meses perdí mi empleo y estuve en trabajos temporales, a causa de la situación por la que atravesamos ya no tuve trabajo y no tengo como sustentar a mi familia, somos mi hijo, mi esposa y yo",San Pablo Villa de Mitla
2020-04-05 05:31:58,933,-99.1802147,18.867191100000003,Otro,Demanda,Pendiente,Si Si Para despensa,Jiutepec
2020-04-05 05:40:40,936,-99.1732936,18.895487399999997,Otro,Demanda,Pendiente,Tres meses 6 meses No tengo trabajotre,Jiutepec
2020-04-05 05:46:44,937,-94.6075948,18.000839399999997,Otro,Demanda,Pendiente,Endoscopia  No tengo dinero y necesito realizarme una endoscopia,Cosoleacaque
2020-04-05 05:56:30,939,-93.1829868,16.7167712,Otro,Demanda,Pendiente,Corto plazo Mediano Soy mamá soltera y desempleada,Tuxtla Gutiérrez
2020-04-05 06:07:13,941,-99.60977940000001,18.556759600000003,Otro,Demanda,Pendiente,Si Si Por que me quede sin empleo,Taxco de Alarcón
2020-04-05 06:11:45,943,-99.5450974,17.439192600000002,Otro,Demanda,Pendiente,Unos 6 mes A largo plaso No tengo trabajo ni entrada de dinero de otro negocio 9 modo,Chilpancingo de los Bravo
2020-04-05 06:15:57,944,-99.2134442,18.9273354,Otro,Demanda,Pendiente,Apoyo economico Apoyo economico Me quede sin trabajo,Cuernavaca
2020-04-05 06:17:51,946,-99.1802147,18.867191100000003,Otro,Demanda,Pendiente,"Pues necesito apoyo, no se si a corto o largo plazo Necesito a largo plazo Me quede sin trabajo desde que cerraron las escuelas porqué vendo en las escuelas",Jiutepec
2020-04-05 06:21:06,947,-99.2134442,18.9273354,Otro,Demanda,Pendiente,Apoyo economico Largo Me quede sin trabajo,Cuernavaca
2020-04-05 06:42:27,949,-103.2879936,20.630913,Otro,Demanda,Pendiente,Comida renta medicina Trabajo Me quedé sin poder trabajar,Tlaquepaque
2020-04-05 06:47:48,950,-99.60977940000001,18.556759600000003,Otro,Demanda,Pendiente,Si a corto plazo Mediano Me quede sin empleo,Taxco de Alarcón
2020-04-05 06:48:18,952,-99.5311939,18.3280249,Otro,Demanda,Pendiente,Despensa  Bajos recursos,Iguala de la Independencia
2020-04-05 06:53:16,955,-98.89327340000001,19.300955399999996,Otro,Demanda,Pendiente,Económico Economico Contingencia,Ixtapaluca
2020-04-05 06:58:35,956,-99.1782479,18.8909108,Otro,Demanda,Pendiente,"Tan pronto puedan solo tengo alimentos para unos días pero no tengo dinero para cubrir luz agua gas. En el tiempo q ustedes puedan pues ya dependo de Dios,si me prestan y me facilitan el pagar en partes,en cuanto pase esto trabajaré y pagaré. No tengo trabajo,vendía antojitos mexicanos pero ya no hay clientes y ya no tengo recursos para pasar estos días de quédate en casa. Mi esposo está enfermo del pulmón y es diabético sin control,si pueden ayudarme lo voy agradecer.",Jiutepec
2020-04-05 07:09:18,957,-99.1961354,19.4515965,Otro,Demanda,Pendiente,Despensa y lozartan para controlar la presión arterial  Sin dinero,Miguel Hidalgo
2020-04-05 07:14:22,958,-98.7777214,22.0036677,Otro,Demanda,Pendiente,Prestamo Prestamo Pensionado discapacitado y con negocio cerrado por contingencia,Tamuín
2020-04-05 07:22:38,959,-88.29598299999999,18.528290300000002,Otro,Demanda,Pendiente,"Despensa, pañales, comida Pago de luz, agua Falta de trabajo",Othón P. Blanco
2020-04-05 07:36:36,960,-92.98957920000001,18.0183005,Otro,Demanda,Pendiente,"Pago de renta de mi vivienda 1,500 Surtido de mi tiendita ambulante Cerraron por la emergencia sanitaria la clínica donde se encuentra mi clientela",Centro
2020-04-05 07:39:39,961,-99.20063540000001,19.4458435,Otro,Demanda,Pendiente,"necesito una despensa a causa del covid 19, ya que me e quedado sin trabajo y no tengo ingresos  me quede sin trabajo por lo del covid y soy madre soltera",Miguel Hidalgo
2020-04-05 07:47:17,963,-99.1802147,18.867191100000003,Otro,Demanda,Pendiente,Ayuda económica por favor Un trabajo estable y que permita la tranquilidad y bienestar de mi familia Me quedé desempleada,Jiutepec
2020-04-05 07:47:28,964,-98.18781159999999,19.0618151,Otro,Demanda,Pendiente,Si Si Desempleo y sin ingreso,Puebla
2020-04-05 07:53:33,965,-99.1774462,18.890867999999998,Otro,Demanda,Pendiente,Apoyó económico Trabajo estable Desempleada,Jiutepec
2020-04-05 07:53:52,966,-88.3032755,18.51352,Otro,Demanda,Pendiente,Corto plazo Corto plazo Porque tengo dos niños y mi esposo le recortaron su trabajo,Othón P. Blanco
2020-04-05 08:00:33,968,-88.3032755,18.51352,Otro,Demanda,Pendiente,Corto plazo Mediano plazo Por que soy madre soltera,Othón P. Blanco
2020-04-05 08:01:05,969,-98.13249040000001,19.0605764,Otro,Demanda,Pendiente,"Si  Por falta de trabajo y carencia de dinero para comprar comida, soy madre soltera y también estudio.",Puebla
2020-04-05 08:05:02,970,-99.1774462,18.890867999999998,Otro,Demanda,Pendiente,Despensa Luz Por economía,Jiutepec
2020-04-05 08:08:25,971,-98.1215677,19.052208,Otro,Demanda,Pendiente,Para pasar la contingencia Para salir adelante de está situcion Por la contingencia que se vive,Amozoc
2020-04-05 08:09:05,972,-99.1774462,18.890867999999998,Otro,Demanda,Pendiente,Alimento Gas y si es posible luz Tengo una edad elevada y me quedé sin trabajo,Jiutepec
2020-04-05 08:09:08,973,-99.0654022,19.4103067,Otro,Demanda,Pendiente,Despensa Económico Madre soltera y sin trabajo,Iztacalco
2020-04-05 08:10:13,974,-88.30206020000001,18.5001577,Otro,Demanda,Pendiente,Despensas o algún apoyo  Por que por la situación que estamos pasando noestoy trabajando y mi esposo también no tiene trabajo vivimos del día a día,Othón P. Blanco
2020-04-05 08:12:25,975,-99.1826372,18.921876899999997,Otro,Demanda,Pendiente,Despensa Gas Bajo presupuesto en dinero,Jiutepec
2020-04-05 08:13:41,976,-99.0553812,19.4104392,Otro,Demanda,Pendiente,Despensa Económica Padre sin empleo,Nezahualcóyotl
2020-04-05 08:15:17,977,-98.19669429999999,19.0090687,Otro,Demanda,Pendiente,6 semanas 9 meses Me mandaron a cuarentena del trabajo sin sueldo,Puebla
2020-04-05 08:19:18,978,-98.13249040000001,19.0605764,Otro,Demanda,Pendiente,Si  Me dedico al arte y me quedé sin trabajo y sin ingresos. Lo que tenía ahorrado fue para pagar la renta de mi casa y los servicios de la misma,Puebla
2020-04-05 08:31:21,979,-99.1746778,19.4445835,Otro,Demanda,Pendiente,Despensa y lozartan y metroprolon  Falta de recursos,Miguel Hidalgo
2020-04-05 08:48:55,981,-99.0474345,19.415624899999997,Otro,Demanda,Pendiente,Económico Económico Tenia un puesto ambulante y pago renta con lo del covid 19 me quitaron del lugar,Nezahualcóyotl
2020-04-05 08:51:56,982,-99.0474345,19.415624899999997,Otro,Demanda,Pendiente,Económico Económico Tenia un puesto ambulante y con lo del covid 19 me lo quitaron pago renta y no tengo dinero,Nezahualcóyotl
2020-04-05 08:52:59,983,-98.17961329999999,19.079877399999997,Otro,Demanda,Pendiente,Corto Y largo plazo Desempleo y estar en casa,Puebla
2020-04-05 08:53:49,984,-89.6604593,21.281181399999998,Otro,Demanda,Pendiente,Economico $2500 Economico Tengo 3 hijos soy de bajos recursos no tengo trabajo,Progreso
2020-04-05 08:54:05,985,-99.1802147,18.867191100000003,Otro,Demanda,Pendiente,300 1000 Desempleo,Jiutepec
2020-04-05 08:54:54,986,-98.17961329999999,19.079877399999997,Otro,Demanda,Pendiente,Corto Y largo Desempleo y estar en casa,Puebla
2020-04-05 08:55:52,987,-88.10708570000001,19.026027499999998,Otro,Demanda,Pendiente,"Leche,pañales ,frijol arroz ,azúcar Pañales,leche canasta básica Me quede sin trabajo hace 2 meses y tengo un bebé recién nacido",Othón P. Blanco
2020-04-05 08:57:10,988,-99.0474345,19.415624899999997,Otro,Demanda,Pendiente,Despensa Económico Tenia mi puesto ambulante y por lo del covid 19 me lo quitaron pago renta y no tengo dinero,Nezahualcóyotl
2020-04-05 08:57:36,989,-99.1753699,18.865223800000003,Otro,Demanda,Pendiente,Dos meaes  Me kese son trabajo por lo mismo de del covi 19 soy mama soltera con dos hijos,Jiutepec
2020-04-05 09:00:14,990,-99.0474345,19.415624899999997,Otro,Demanda,Pendiente,Despensa Económico Tenia un puesto ambulante y con lo del covid 19 me lo quitaron pago renta y no tengo dinero,Nezahualcóyotl
2020-04-05 09:00:47,991,-88.673665,18.486415,Otro,Demanda,Pendiente,"Leche, pañales de bebé, despensa basica Luz, agua, No tengo recurso por motivos de falta de trabajo",Othón P. Blanco
2020-04-05 09:01:38,992,-99.60282190000001,18.5512405,Otro,Demanda,Pendiente,Mantener a mi hijo Pagar deudas Me despidieron del trabajo sin goce de sueldo y tengo un hijo que mantener,Taxco de Alarcón
2020-04-05 09:03:34,993,-99.60282190000001,18.5512405,Otro,Demanda,Pendiente,Mantener a mi hija Pagar deudas Estoy desemplea,Taxco de Alarcón
2020-04-05 09:03:38,994,-99.1483827,18.8820045,Otro,Demanda,Pendiente,Largo plazo Largo plazo Por que no cuento con un trabajo,Jiutepec
2020-04-05 09:04:26,995,-99.26137290000001,19.4444118,Otro,Demanda,Pendiente,"Despensa Económico Ya no dejaron poner mi puesto de dulces tengo 3 hijos, una señorita con PCI y 2 con problemas de salud aún no diagnosticados (posible cancer)",Naucalpan de Juárez
2020-04-05 09:08:53,998,-99.1483827,18.8820045,Otro,Demanda,Pendiente,A largo plazo A largo plazo No cuento con trabajo,Jiutepec
2020-04-05 09:10:58,1000,-99.1483827,18.8820045,Otro,Demanda,Pendiente,Largo plazo Largo plazo No cuento con un trabajo,Jiutepec
2020-04-05 09:19:19,1001,-99.10134980000001,18.6813049,Otro,Demanda,Pendiente,Una despensa y un apoyo económico  Por que nuestras ventas an bajado mucho,Tlaltizapán
2020-04-05 09:40:11,1004,-99.1774462,18.890867999999998,Otro,Demanda,Pendiente,2000 2000 Me quede sin empleo,Jiutepec
2020-04-05 09:42:31,1005,-99.1774462,18.890867999999998,Otro,Demanda,Pendiente,2000 2000 Me he quedado sin trabajo,Jiutepec
2020-04-05 09:49:33,1007,-99.2473801,18.9293214,Otro,Demanda,Pendiente,Pues por el Coronavirus  Me quedé sin trabajo,Cuernavaca
2020-04-05 09:54:52,1008,-99.1802147,18.867191100000003,Otro,Demanda,Pendiente,Para alimentar a mi familia Mediano Soy de bajo recurso,Jiutepec
2020-04-05 09:58:18,1009,-99.23560479999999,18.943886499999998,Otro,Demanda,Pendiente,500 800 Me quede sin trabajo,Cuernavaca
2020-04-05 10:02:34,1010,-88.3178568,18.5284851,Otro,Demanda,Pendiente,Alimentos Pago de servicios Pagar mi renta,Othón P. Blanco
